name,image_url,category,price,stock,description
Flat-Front Slim Fit Chinos,https://assets.ajio.com/medias/sys_master/root/20210316/73wc/6050cc797cdb8c1f1464efbc/-286Wx359H-460259760-blue-MODEL.jpg,Men,"1,899",100,Flat-Front Slim Fit Chinos
Distressed Skinny Cropped Jeans,https://assets.ajio.com/medias/sys_master/root/20210629/HWS0/60da3bf6f997ddb312115253/-286Wx359H-441122773-grey-MODEL.jpg,Men,"1,499",100,Distressed Skinny Cropped Jeans
Logo Print T-shirt with Crew-Neck,https://assets.ajio.com/medias/sys_master/root/20211014/3Zzy/616831f5aeb269011092dd1a/-286Wx359H-469019706-white-MODEL.jpg,Men,"1,499",100,Logo Print T-shirt with Crew-Neck
Mid-Wash Slim Fit Jeans,https://assets.ajio.com/medias/sys_master/root/20220111/pdKA/61dc933baeb2695cdd0c9cff/-286Wx359H-469084022-blue-MODEL.jpg,Men,"2,899",100,Mid-Wash Slim Fit Jeans
Lightly Wash Slim Fit Jeans,https://assets.ajio.com/medias/sys_master/root/20220111/6aSl/61dcb2b8f997dd66231a5764/-286Wx359H-469084056-grey-MODEL.jpg,Men,"2,899",100,Lightly Wash Slim Fit Jeans
Checked Slim Fit Shirt with Patch Pocket,https://assets.ajio.com/medias/sys_master/root/20210316/IIPo/604fb2c1f997dd5c40115f4c/-286Wx359H-460698942-beige-MODEL.jpg,Men,"1,749",100,Checked Slim Fit Shirt with Patch Pocket
Straight Track Pants with Insert Pockets,https://assets.ajio.com/medias/sys_master/root/20220426/7Stq/62670b11f997dd03e280fe76/-286Wx359H-464233835-blue-MODEL.jpg,Men,"1,299",100,Straight Track Pants with Insert Pockets
Speckled Panelled Joggers with Insert Pockets,https://assets.ajio.com/medias/sys_master/root/20210810/SuIn/61117d857cdb8cb824efd21f/-286Wx359H-441119474-grey-MODEL.jpg,Men,899,100,Speckled Panelled Joggers with Insert Pockets
Joggers with Insert Pockets,https://assets.ajio.com/medias/sys_master/root/20220408/L7MZ/62502046f997dd03e24f9d47/-286Wx359H-464146277-olive-MODEL.jpg,Men,"1,299",100,Joggers with Insert Pockets
Striped Slim Fit Shirt with Patch Pocket,https://assets.ajio.com/medias/sys_master/root/20220208/8yl5/62017535f997dd03e2c49645/-286Wx359H-441132421-orange-MODEL.jpg,Men,"1,049",100,Striped Slim Fit Shirt with Patch Pocket
Relaxed Fit Joggers with Drawstring,https://assets.ajio.com/medias/sys_master/root/20211103/HOql/61819582aeb2690110b792de/-286Wx359H-441134947-jetblack-MODEL.jpg,Men,"1,399",100,Relaxed Fit Joggers with Drawstring
Superstate Embroidered Polo T-shirt,https://assets.ajio.com/medias/sys_master/root/h34/h21/15398407307294/-286Wx359H-410243861-pg5-MODEL.jpg,Men,"4,999",100,Superstate Embroidered Polo T-shirt
Colourblock Hoodie with Ribbed Hems,https://assets.ajio.com/medias/sys_master/root/20210904/rZFp/61326a707cdb8cb824164932/-286Wx359H-441126831-black-MODEL.jpg,Men,"1,299",100,Colourblock Hoodie with Ribbed Hems
Slim Fit Camo Print Cargo Joggers,https://assets.ajio.com/medias/sys_master/root/20210316/GPBl/604facaaf997dd5c401145b5/-286Wx359H-460436196-olive-MODEL.jpg,Men,"2,099",100,Slim Fit Camo Print Cargo Joggers
511Z Heavy-Wash Straight Fit Jeans,https://assets.ajio.com/medias/sys_master/root/20220408/pzkq/62504f68aeb26921af138253/-286Wx359H-469133423-blue-MODEL.jpg,Men,"3,699",100,511Z Heavy-Wash Straight Fit Jeans
Slim Fit Flat-Front Chinos with Insert Pockets,https://assets.ajio.com/medias/sys_master/root/20210731/rHUO/61044e17f997ddb312417eab/-286Wx359H-441121060-ltblue-MODEL.jpg,Men,"1,299",100,Slim Fit Flat-Front Chinos with Insert Pockets
Heathered Crew-Neck T-shirt,https://assets.ajio.com/medias/sys_master/root/h99/hce/13480453013534/-286Wx359H-441000453-ltblue-MODEL.jpg,Men,399,100,Heathered Crew-Neck T-shirt
Flat-Front City Shorts,https://assets.ajio.com/medias/sys_master/root/20210814/hriC/6116d7b97cdb8cb824f7a9ed/-286Wx359H-441124430-olivegreen-MODEL.jpg,Men,899,100,Flat-Front City Shorts
Printed Cotton Polo T-shirt,https://assets.ajio.com/medias/sys_master/root/20220301/YXnV/621e3e73f997dd03e2f866c6/-286Wx359H-441137356-white-MODEL.jpg,Men,699,100,Printed Cotton Polo T-shirt
Gradation Tonal Striped Crew-Neck Pullover,https://assets.ajio.com/medias/sys_master/root/20210913/pXDo/613f6ec97cdb8cb824200b09/-286Wx359H-441120750-tomatored-MODEL.jpg,Men,"1,049",100,Gradation Tonal Striped Crew-Neck Pullover
Mid-Wash Slim Fit Jeans,https://assets.ajio.com/medias/sys_master/root/20220310/MUxJ/6228fad3f997dd03e20a02bd/-286Wx359H-460977769-blue-MODEL.jpg,Men,"2,799",100,Mid-Wash Slim Fit Jeans
Slim Fit Shirt with Patch Pocket,https://assets.ajio.com/medias/sys_master/root/20210420/azH9/607ecc15aeb269a9e3971ba9/-286Wx359H-462323964-peach-MODEL.jpg,Men,"1,849",100,Slim Fit Shirt with Patch Pocket
Mid-Rise Slim Fit Jeans with Whiskers,https://assets.ajio.com/medias/sys_master/root/20220413/6aYq/6255cd0aaeb26921af1ca7cb/-286Wx359H-469134981-indigo-MODEL.jpg,Men,"2,899",100,Mid-Rise Slim Fit Jeans with Whiskers
Heathered Zip-Front Hoodie with Insert Pockets,https://assets.ajio.com/medias/sys_master/root/20211004/tU1d/615ab32cf997ddce89f2c710/-286Wx359H-441124100-anthramelange-MODEL.jpg,Men,"1,049",100,Heathered Zip-Front Hoodie with Insert Pockets
Graphic Print Crew-Neck T-shirt,https://assets.ajio.com/medias/sys_master/root/20210403/GqvZ/606888c37cdb8c1f14778120/-286Wx359H-461415957-black-MODEL.jpg,Men,"1,199",100,Graphic Print Crew-Neck T-shirt
Striped Shirt with Curved Hemline,https://assets.ajio.com/medias/sys_master/root/20211202/h4qv/61a7d009aeb2690110e9f47a/-286Wx359H-463417754-blue-MODEL.jpg,Men,"1,499",100,Striped Shirt with Curved Hemline
Relaxed Fit Joggers with Drawstring,https://assets.ajio.com/medias/sys_master/root/20211103/AbjD/61819dffaeb2690110b7b518/-286Wx359H-441134947-olivegreen-MODEL.jpg,Men,"1,399",100,Relaxed Fit Joggers with Drawstring
Panelled City Shorts with Insert Pockets,https://assets.ajio.com/medias/sys_master/root/20210615/5SXi/60c7acc7f997ddb312c92777/-286Wx359H-441118458-ecru-MODEL.jpg,Men,799,100,Panelled City Shorts with Insert Pockets
Striped Shirt with Patch Pocket,https://assets.ajio.com/medias/sys_master/root/20210810/KZi2/611183a27cdb8cb824efe29a/-286Wx359H-441123881-white-MODEL.jpg,Men,999,100,Striped Shirt with Patch Pocket
Band Collar Slim Fit Shirt,https://assets.ajio.com/medias/sys_master/root/20210403/ORxf/60691fd6aeb269a9e33ea4f2/-286Wx359H-462103975-purple-MODEL.jpg,Men,"1,849",100,Band Collar Slim Fit Shirt
Solid Cotton Polo T-shirt,https://assets.ajio.com/medias/sys_master/root/hf9/h2d/14798117601310/-286Wx359H-441024764-maroon-MODEL.jpg,Men,699,100,Solid Cotton Polo T-shirt
Checked Slim Fit Shirt with Patch Pocket,https://assets.ajio.com/medias/sys_master/root/20210316/TUEw/604fb8947cdb8c1f14634d72/-286Wx359H-460698908-brown-MODEL.jpg,Men,"1,749",100,Checked Slim Fit Shirt with Patch Pocket
Typographic Print Shorts with Slip Pockets,https://assets.ajio.com/medias/sys_master/root/20210211/xXNh/60243337f997dd5c40ed520d/-286Wx359H-441113672-petrol-MODEL.jpg,Men,499,100,Typographic Print Shorts with Slip Pockets
Tapered Fit Flat-Front Trousers,https://assets.ajio.com/medias/sys_master/root/20210913/C7pU/613f74e2aeb269a26890ccaf/-286Wx359H-441124497-darkgreen-MODEL.jpg,Men,"1,499",100,Tapered Fit Flat-Front Trousers
Mid-Rise Slim Fit Jeans,https://assets.ajio.com/medias/sys_master/root/20211207/D1vw/61ae5facaeb2690110f6ee04/-286Wx359H-441209072-black-MODEL.jpg,Men,"2,399",100,Mid-Rise Slim Fit Jeans
Heathered Henley T-shirt with Contrast Tipping,https://assets.ajio.com/medias/sys_master/root/20210714/cabP/60ede5d3f997ddb3122642ea/-286Wx359H-441118122-green-MODEL.jpg,Men,799,100,Heathered Henley T-shirt with Contrast Tipping
Checked Slim Fit Shirt with Patch Pocket,https://assets.ajio.com/medias/sys_master/root/20210316/uFwv/604faf867cdb8c1f146331ca/-286Wx359H-460698909-blue-MODEL.jpg,Men,"1,749",100,Checked Slim Fit Shirt with Patch Pocket
511 Washed Slim Fit Jeans,https://assets.ajio.com/medias/sys_master/root/20211103/3lM7/6181aaa2f997ddf8f1f899f5/-286Wx359H-460977736-blue-MODEL.jpg,Men,"2,799",100,511 Washed Slim Fit Jeans
Short Sleeves Polo T-shirt,https://assets.ajio.com/medias/sys_master/root/20210403/UraZ/60691d23aeb269a9e33e72fe/-286Wx359H-462122078-black-MODEL.jpg,Men,"1,199",100,Short Sleeves Polo T-shirt
Mid-Rise Mid-Wash Slim Jeans,https://assets.ajio.com/medias/sys_master/root/20220425/YOAg/62669735aeb26921af3fcd9a/-286Wx359H-463775951-blue-MODEL.jpg,Men,"2,199",100,Mid-Rise Mid-Wash Slim Jeans
Typographic Print Crew-Neck T-shirt,https://assets.ajio.com/medias/sys_master/root/20211202/QCqN/61a7eb3ef997ddf8f12d7c0a/-286Wx359H-441126599-darkkhaki-MODEL.jpg,Men,399,100,Typographic Print Crew-Neck T-shirt
Pack of 2 Vests,https://assets.ajio.com/medias/sys_master/root/20210731/o5o9/610449e6aeb269a9e35b78d5/-286Wx359H-441127152-white-MODEL.jpg,Men,299,100,Pack of 2 Vests
Brand Print V-neck T-shirt,https://assets.ajio.com/medias/sys_master/root/20211230/usyW/61ccb2aeaeb2690110230233/-286Wx359H-441243586-mustard-MODEL.jpg,Men,599,100,Brand Print V-neck T-shirt
Striped Shirt with Patch Pocket,https://assets.ajio.com/medias/sys_master/root/20210601/d8KH/60b53b89aeb269a9e3cebe6a/-286Wx359H-441123875-navy-MODEL.jpg,Men,999,100,Striped Shirt with Patch Pocket
Brand Print Shorts with Drawstring Waist,https://assets.ajio.com/medias/sys_master/root/20210706/pOK2/60e3609caeb269a9e337ff8f/-286Wx359H-441123544-navy-MODEL.jpg,Men,799,100,Brand Print Shorts with Drawstring Waist
Hooded T-shirt with Drawstring Fastening,https://assets.ajio.com/medias/sys_master/root/20210415/8SqO/60785ba8f997dd7b64b30e9a/-286Wx359H-441118793-blue-MODEL.jpg,Men,799,100,Hooded T-shirt with Drawstring Fastening
Mid-Wash Slim Fit Jeans,https://assets.ajio.com/medias/sys_master/root/20220211/1w3N/620566a6aeb26921af92ad5b/-286Wx359H-469084010-grey-MODEL.jpg,Men,"2,899",100,Mid-Wash Slim Fit Jeans
Mid-Wash Distressed Slim Jeans,https://assets.ajio.com/medias/sys_master/root/20220126/GyRr/61f04b68f997dd66233c769c/-286Wx359H-460977763-blue-MODEL.jpg,Men,"2,799",100,Mid-Wash Distressed Slim Jeans
Tapered Fit Flat-Fit Chinos,https://assets.ajio.com/medias/sys_master/root/20211009/f6b2/61612e90f997ddce891172cc/-286Wx359H-441128280-grey-MODEL.jpg,Men,"1,499",100,Tapered Fit Flat-Fit Chinos
Flat-Front Slim Fit Chinos,https://assets.ajio.com/medias/sys_master/root/20210316/XPAC/6050ca1bf997dd5c4013a9a4/-286Wx359H-460259760-navy-MODEL.jpg,Men,"1,899",100,Flat-Front Slim Fit Chinos
Tropical Print Crew-Neck T-shirt,https://assets.ajio.com/medias/sys_master/root/20220429/tii8/626c26bcf997dd03e28b8fbc/-286Wx359H-441137286-navy-MODEL.jpg,Men,449,100,Tropical Print Crew-Neck T-shirt
Checked Flat-Front Joggers with Insert Pockets,https://assets.ajio.com/medias/sys_master/root/20210727/qeCx/60ff15b0f997ddb31238a063/-286Wx359H-441120117-darkblue-MODEL.jpg,Men,"1,499",100,Checked Flat-Front Joggers with Insert Pockets
Washed Slim Fit Jeans,https://assets.ajio.com/medias/sys_master/root/20220212/Xphc/6206b699aeb26921af94fff5/-286Wx359H-469084067-blue-MODEL.jpg,Men,"2,899",100,Washed Slim Fit Jeans
Checked Slim Fit Shirt with Patch Pocket,https://assets.ajio.com/medias/sys_master/root/20210316/dBPv/604fad99aeb2696981863ff4/-286Wx359H-460698937-purple-MODEL.jpg,Men,"1,749",100,Checked Slim Fit Shirt with Patch Pocket
Graphic Print Crew-Neck T-shirt,https://assets.ajio.com/medias/sys_master/root/20220301/8XQC/621e4576aeb26921afbf4728/-286Wx359H-441134756-lime-MODEL.jpg,Men,599,100,Graphic Print Crew-Neck T-shirt
Slim Fit Colourblock Crew-Neck T-shirt,https://assets.ajio.com/medias/sys_master/root/20220422/if3W/6261b1d1f997dd03e2784eb7/-286Wx359H-469164936-black-MODEL.jpg,Men,"2,799",100,Slim Fit Colourblock Crew-Neck T-shirt
Slim Fit Flat-Front Trousers with Insert Pockets,https://assets.ajio.com/medias/sys_master/root/20210814/pfnA/6116cb0aaeb269a2687247b8/-286Wx359H-441125999-stone-MODEL.jpg,Men,"1,499",100,Slim Fit Flat-Front Trousers with Insert Pockets
Striped Slim Fit Shirt with Patch Pocket,https://assets.ajio.com/medias/sys_master/root/20210401/byO4/6065e5807cdb8c1f14731d9e/-286Wx359H-441120090-navy-MODEL.jpg,Men,999,100,Striped Slim Fit Shirt with Patch Pocket
Striped Slim Fit Shirt with Patch Pocket,https://assets.ajio.com/medias/sys_master/root/20210316/3d2o/6050cde2f997dd5c4013bbfa/-286Wx359H-460815160-yellow-MODEL.jpg,Men,"1,749",100,Striped Slim Fit Shirt with Patch Pocket
Pack of 2 Socks with Logo Pattern,https://assets.ajio.com/medias/sys_master/root/20220408/PHy0/624f301aaeb26921af11467e/-286Wx359H-441294853-multi-MODEL.jpg,Men,249,100,Pack of 2 Socks with Logo Pattern
Mid-Wash Slim-Fit Jeans,https://assets.ajio.com/medias/sys_master/root/20220111/Emxo/61dc850faeb2695cdd0c6290/-286Wx359H-469084028-blue-MODEL.jpg,Men,"2,899",100,Mid-Wash Slim-Fit Jeans
Flat-Front Chinos with Insert Pockets,https://assets.ajio.com/medias/sys_master/root/20210714/AfRG/60ede469aeb269a9e3424b10/-286Wx359H-441119381-olivegreen-MODEL.jpg,Men,"1,499",100,Flat-Front Chinos with Insert Pockets
Slim Fit Shirt with Patch Pocket,https://assets.ajio.com/medias/sys_master/root/20210420/inRK/607ecc91aeb269a9e3972384/-286Wx359H-462323964-yellow-MODEL.jpg,Men,"1,849",100,Slim Fit Shirt with Patch Pocket
Checked Slim Fit Shirt with Patch Pocket,https://assets.ajio.com/medias/sys_master/root/20210403/luQG/6068d82daeb269a9e339fd61/-286Wx359H-462122156-yellow-MODEL.jpg,Men,"1,299",100,Checked Slim Fit Shirt with Patch Pocket
Mid-Rise Panelled Joggers,https://assets.ajio.com/medias/sys_master/root/h02/hf8/11858933514270/-286Wx359H-460265535-multi-MODEL.jpg,Men,"2,995",100,Mid-Rise Panelled Joggers
Cotton Shirt with Patch Pocket,https://assets.ajio.com/medias/sys_master/root/20210819/gclb/611e7443f997ddce89a5e3fc/-286Wx359H-441123441-olive-MODEL.jpg,Men,999,100,Cotton Shirt with Patch Pocket
Speckled Polo T-shirt with Contrast Tipping,https://assets.ajio.com/medias/sys_master/root/h11/h1a/13550750138398/-286Wx359H-441000675-blue-MODEL.jpg,Men,599,100,Speckled Polo T-shirt with Contrast Tipping
Striped Polo T-shirt,https://assets.ajio.com/medias/sys_master/root/20211002/z1yA/61578743aeb2692b859a82eb/-286Wx359H-441116555-blue-MODEL.jpg,Men,899,100,Striped Polo T-shirt
Tapered Fit Chinos with Waist Tie-Up,https://assets.ajio.com/medias/sys_master/root/20211208/rOP5/61afb3e5f997ddf8f1422e74/-286Wx359H-441124625-navy-MODEL.jpg,Men,"1,499",100,Tapered Fit Chinos with Waist Tie-Up
Floral Print Slim Fit Shirt,https://assets.ajio.com/medias/sys_master/root/20211027/Zy7D/61784abbf997ddf8f1ea591b/-286Wx359H-460552792-white-MODEL.jpg,Men,"2,099",100,Floral Print Slim Fit Shirt
Mid-Wash Slim Fit Jeans,https://assets.ajio.com/medias/sys_master/root/20211009/uNyk/6161ced4f997ddce8913cca1/-286Wx359H-460977728-blue-MODEL.jpg,Men,"2,499",100,Mid-Wash Slim Fit Jeans
Crew-Neck T-shirt with Contrast Stripes,https://assets.ajio.com/medias/sys_master/root/20210403/3Bjo/60686845aeb269a9e3319e37/-286Wx359H-461083544-grey-MODEL.jpg,Men,"1,199",100,Crew-Neck T-shirt with Contrast Stripes
Slim Fit Shorts with Pockets,https://assets.ajio.com/medias/sys_master/root/20210627/LmBe/60d87465f997ddb312f4ee47/-286Wx359H-461152806-white-MODEL.jpg,Men,"1,599",100,Slim Fit Shorts with Pockets
Mid-Rise Skinny Jeans,https://assets.ajio.com/medias/sys_master/root/h16/h38/14876758048798/-286Wx359H-441038480-ltblue-MODEL.jpg,Men,799,100,Mid-Rise Skinny Jeans
Polo T-shirt with Typography,https://assets.ajio.com/medias/sys_master/root/20211006/VP6l/615dd89aaeb2692b85b24ee1/-286Wx359H-460971697-red-MODEL.jpg,Men,"1,399",100,Polo T-shirt with Typography
Striped Crew-Neck T-shirt,https://assets.ajio.com/medias/sys_master/root/20210601/nKX3/60b54034aeb269a9e3cecff3/-286Wx359H-441119693-blue-MODEL.jpg,Men,499,100,Striped Crew-Neck T-shirt
Slub-Knit Crew-Neck T-shirt with Flap Pocket,https://assets.ajio.com/medias/sys_master/root/20210525/Vilg/60ac276baeb269a9e3c83f61/-286Wx359H-441119080-blue-MODEL.jpg,Men,599,100,Slub-Knit Crew-Neck T-shirt with Flap Pocket
Heathered Joggers with Insert Pockets,https://assets.ajio.com/medias/sys_master/root/20210601/IAaG/60b538aef997ddb312af3645/-286Wx359H-441119486-maroon-MODEL.jpg,Men,899,100,Heathered Joggers with Insert Pockets
Logo Print Round-Neck T-shirt,https://assets.ajio.com/medias/sys_master/root/20220408/9sPz/62505b1daeb26921af13c179/-286Wx359H-460970988-green-MODEL.jpg,Men,"1,099",100,Logo Print Round-Neck T-shirt
Quick-Dry Cuffed Track Pants with Placement Print,https://assets.ajio.com/medias/sys_master/root/20220303/Yebq/621fc5d3aeb26921afc3e100/-286Wx359H-441134827-darkblue-MODEL.jpg,Men,799,100,Quick-Dry Cuffed Track Pants with Placement Print
Checked Slim Fit Shirt,https://assets.ajio.com/medias/sys_master/root/20211030/0PXd/617c50dcf997ddf8f1f2d840/-286Wx359H-460698906-navyblue-MODEL.jpg,Men,"1,749",100,Checked Slim Fit Shirt
Solid Collar Neck Polo T-shirt,https://assets.ajio.com/medias/sys_master/root/20211003/kU41/6159ab90aeb2692b859f8b44/-286Wx359H-463026924-pink-MODEL.jpg,Men,449,100,Solid Collar Neck Polo T-shirt
Slim Fit Checked Shirt with Patch Pocket,https://assets.ajio.com/medias/sys_master/root/20211125/jogy/619e8531f997ddf8f119cb53/-286Wx359H-460353520-maroon-MODEL.jpg,Men,"1,749",100,Slim Fit Checked Shirt with Patch Pocket
Striped Shirt with Patch Pocket,https://assets.ajio.com/medias/sys_master/root/20210629/uPHt/60da47adaeb269a9e32ee03b/-286Wx359H-441123880-white-MODEL.jpg,Men,999,100,Striped Shirt with Patch Pocket
Mid-Rise Jogger Jeans with Zip Pocket,https://assets.ajio.com/medias/sys_master/root/20211013/QZyi/61663036aeb26901108f0ce4/-286Wx359H-461094398-blue-MODEL.jpg,Men,"1,799",100,Mid-Rise Jogger Jeans with Zip Pocket
Heavily Washed Skinny Fit Jeans,https://assets.ajio.com/medias/sys_master/root/20211202/V390/61a7f4a4aeb2690110eaec48/-286Wx359H-441124318-ltgrey-MODEL.jpg,Men,"1,299",100,Heavily Washed Skinny Fit Jeans
Graphic Print Round-Neck T-shirt,https://assets.ajio.com/medias/sys_master/root/20220419/iGdV/625dbf14aeb26921af296a20/-286Wx359H-441134755-jetblack-MODEL.jpg,Men,899,100,Graphic Print Round-Neck T-shirt
Track Pants with Elasticated Drawstring Waist,https://assets.ajio.com/medias/sys_master/root/20220408/9uet/624f3cd1f997dd03e24e0db6/-286Wx359H-441134820-darkblue-MODEL.jpg,Men,"1,499",100,Track Pants with Elasticated Drawstring Waist
Logo Print Shorts with Insert Pockets,https://assets.ajio.com/medias/sys_master/root/20220415/MYZo/62598e99f997dd03e2617bfe/-286Wx359H-441134790-darkgrey-MODEL.jpg,Men,799,100,Logo Print Shorts with Insert Pockets
Graphic Print Crew-Neck T-shirt,https://assets.ajio.com/medias/sys_master/root/20210403/LHlK/6068c5bcf997dd7b64656298/-286Wx359H-462112402-grey-MODEL.jpg,Men,999,100,Graphic Print Crew-Neck T-shirt
Full-Sleeve Henley T-shirt,https://assets.ajio.com/medias/sys_master/root/20210913/3UqS/613f6b0c7cdb8cb8241fffe8/-286Wx359H-441125580-ecrumelange-MODEL.jpg,Men,"1,399",100,Full-Sleeve Henley T-shirt
Washed Skinny Cropped Jeans,https://assets.ajio.com/medias/sys_master/root/20211217/Nu3m/61bcaab8f997ddf8f1556032/-286Wx359H-441124247-mediumblue-MODEL.jpg,Men,"1,499",100,Washed Skinny Cropped Jeans
Track Pants with Contrast Taping,https://assets.ajio.com/medias/sys_master/root/20210211/7h9g/602427e8f997dd5c40ed2c3d/-286Wx359H-441031716-darkgrey-MODEL.jpg,Men,499,100,Track Pants with Contrast Taping
Quickdry Unlined Running Windbreaker Jacket,https://assets.ajio.com/medias/sys_master/root/20201225/uTHR/5fe610a2aeb2694fd3000aa6/-286Wx359H-441110840-jetblack-MODEL.jpg,Men,999,100,Quickdry Unlined Running Windbreaker Jacket
Striped Crew-Neck Sweatshirt,https://assets.ajio.com/medias/sys_master/root/20210722/xw8j/60f8744ef997ddb31230d7c1/-286Wx359H-441124533-maroon-MODEL.jpg,Men,"1,049",100,Striped Crew-Neck Sweatshirt
Typographic Print Polo T-shirt,https://assets.ajio.com/medias/sys_master/root/20210316/rV8f/604fb3b17cdb8c1f14633b48/-286Wx359H-441118121-white-MODEL.jpg,Men,799,100,Typographic Print Polo T-shirt
Track Pants with Elasticated Drawstring Waist,https://assets.ajio.com/medias/sys_master/root/20220322/oQy1/6238cd91aeb26921afe92b68/-286Wx359H-441134820-jetblack-MODEL.jpg,Men,"1,499",100,Track Pants with Elasticated Drawstring Waist
Striped Polo T-shirt with Placement Applique,https://assets.ajio.com/medias/sys_master/root/20210714/Pq9z/60ede5c8aeb269a9e3424eef/-286Wx359H-441123992-white-MODEL.jpg,Men,799,100,Striped Polo T-shirt with Placement Applique
Checked Shirt with Patch Pocket,https://assets.ajio.com/medias/sys_master/root/20211019/Vc2f/616de487aeb26901109b2a4a/-286Wx359H-441123944-aquablue-MODEL.jpg,Men,999,100,Checked Shirt with Patch Pocket
Washed Denim Slim Fit Shirt with Patch Pocket,https://assets.ajio.com/medias/sys_master/root/20210403/Z7oi/60686ba57cdb8c1f14756cb4/-286Wx359H-461118849-blue-MODEL.jpg,Men,"2,499",100,Washed Denim Slim Fit Shirt with Patch Pocket
Printed Polo T-shirt,https://assets.ajio.com/medias/sys_master/root/20220224/NzRC/621685d9aeb26921afb2fed5/-286Wx359H-441137508-maroon-MODEL.jpg,Men,699,100,Printed Polo T-shirt
Printed Polo T-shirt,https://assets.ajio.com/medias/sys_master/root/20220322/bz8Y/6238d3e0aeb26921afe94cd3/-286Wx359H-441137508-teal-MODEL.jpg,Men,699,100,Printed Polo T-shirt
512 Light-Wash Slim Fit Jeans,https://assets.ajio.com/medias/sys_master/root/20211208/60T5/61afb4bef997ddf8f1423efe/-286Wx359H-460977767-blue-MODEL.jpg,Men,"2,799",100,512 Light-Wash Slim Fit Jeans
Slim Fit Shirt with Patch Pocket,https://assets.ajio.com/medias/sys_master/root/20210420/H6Fy/607eccadaeb269a9e397252c/-286Wx359H-462323964-burgundy-MODEL.jpg,Men,"1,849",100,Slim Fit Shirt with Patch Pocket
Mid-Wash Slim-Fit Jeans,https://assets.ajio.com/medias/sys_master/root/20220111/gHES/61dca3e6aeb2695cdd0d908c/-286Wx359H-469084023-blue-MODEL.jpg,Men,"2,899",100,Mid-Wash Slim-Fit Jeans
Sports Shorts with Insert Pockets,https://assets.ajio.com/medias/sys_master/root/20220408/swzj/624f3720f997dd03e24df374/-286Wx359H-441134790-grey-MODEL.jpg,Men,799,100,Sports Shorts with Insert Pockets
Zip-Front Puffer Jacket with Insert Pockets,https://assets.ajio.com/medias/sys_master/root/20210615/K0Ca/60c7b263aeb269a9e3e7824d/-286Wx359H-441120416-black-MODEL.jpg,Men,"1,999",100,Zip-Front Puffer Jacket with Insert Pockets
Joggers with Insert Pockets,https://assets.ajio.com/medias/sys_master/root/20220308/t2l6/62267542f997dd03e2062a70/-286Wx359H-469037409-black-MODEL.jpg,Men,"1,999",100,Joggers with Insert Pockets
Joggers with Zip Pockets,https://assets.ajio.com/medias/sys_master/root/20211006/mb6L/615dd879f997ddce89042b1d/-286Wx359H-441120675-olive-MODEL.jpg,Men,999,100,Joggers with Zip Pockets
Checked Slim Fit Shirt with Patch Pocket,https://assets.ajio.com/medias/sys_master/root/20210316/s4Bw/604fb596aeb26969818650c5/-286Wx359H-460698926-navy-MODEL.jpg,Men,"1,749",100,Checked Slim Fit Shirt with Patch Pocket
Textured Flat-Front Trousers,https://assets.ajio.com/medias/sys_master/root/20210323/Xx9V/6059e4ad7cdb8c1f146b74e7/-286Wx359H-441119382-stone-MODEL.jpg,Men,"1,499",100,Textured Flat-Front Trousers
Full Sleeves Slim Fit Shirt,https://assets.ajio.com/medias/sys_master/root/20210403/KgPK/6068d76caeb269a9e339ec3a/-286Wx359H-462103975-white-MODEL.jpg,Men,"1,849",100,Full Sleeves Slim Fit Shirt
Checked Slim Fit Shirt with Patch Pocket,https://assets.ajio.com/medias/sys_master/root/20210316/b312/604fbdfbf997dd5c40118fc5/-286Wx359H-460699015-white-MODEL.jpg,Men,"1,749",100,Checked Slim Fit Shirt with Patch Pocket
Colorblock Crew-Neck T-shirt,https://assets.ajio.com/medias/sys_master/root/20211202/gpRx/61a7c291f997ddf8f12c4fb4/-286Wx359H-441133214-navy-MODEL.jpg,Men,549,100,Colorblock Crew-Neck T-shirt
Typographic Print Shorts with Slip Pockets,https://assets.ajio.com/medias/sys_master/root/20220528/qxLo/629159afaeb26921afeecd44/-286Wx359H-441113672-grey-MODEL.jpg,Men,499,100,Typographic Print Shorts with Slip Pockets
Washed Distressed Slim Fit Jeans,https://assets.ajio.com/medias/sys_master/root/20200918/eQeI/5f63be6af997dd8c8341d3eb/-286Wx359H-460698976-blue-MODEL.jpg,Men,"1,999",100,Washed Distressed Slim Fit Jeans
Flat-Front City Shorts,https://assets.ajio.com/medias/sys_master/root/20210814/Z8Vy/6116c0c27cdb8cb824f757b1/-286Wx359H-441124430-stone-MODEL.jpg,Men,899,100,Flat-Front City Shorts
Checked Shirt with Patch Pocket,https://assets.ajio.com/medias/sys_master/root/20210629/tfw9/60da45a5aeb269a9e32ec03d/-286Wx359H-441123884-khaki-MODEL.jpg,Men,999,100,Checked Shirt with Patch Pocket
Cropped Slim Chinos with Slip Pockets,https://assets.ajio.com/medias/sys_master/root/20211123/KOZN/619c034aaeb2690110d15070/-286Wx359H-441131542-white-MODEL.jpg,Men,"1,299",100,Cropped Slim Chinos with Slip Pockets
Lightly Washed Distressed Slim Jeans ,https://assets.ajio.com/medias/sys_master/root/20220425/f2qH/62669463f997dd03e27df699/-286Wx359H-461339973-blue-MODEL.jpg,Men,"1,899",100,Lightly Washed Distressed Slim Jeans 
Checked Slim Fit Shirt with Patch Pocket,https://assets.ajio.com/medias/sys_master/root/20200827/5Wky/5f4769a8f997dd6918abfef9/-286Wx359H-460698892-white-MODEL.jpg,Men,"1,749",100,Checked Slim Fit Shirt with Patch Pocket
Typographic Print Round-Neck T-shirt,https://assets.ajio.com/medias/sys_master/root/20220408/XggG/624f2e37aeb26921af114054/-286Wx359H-441134822-tintblue-MODEL.jpg,Men,599,100,Typographic Print Round-Neck T-shirt
Shirt with Band Collar,https://assets.ajio.com/medias/sys_master/root/20210323/QM95/6059e5977cdb8c1f146b7695/-286Wx359H-441119791-khaki-MODEL.jpg,Men,999,100,Shirt with Band Collar
Solid Collar Neck Polo T-shirt,https://assets.ajio.com/medias/sys_master/root/20211001/aXhC/61566852f997ddce89ea35f2/-286Wx359H-463026924-navy-MODEL.jpg,Men,449,100,Solid Collar Neck Polo T-shirt
Typographic Print Shorts with Slip Pockets,https://assets.ajio.com/medias/sys_master/root/20220429/meXM/626c0df2f997dd03e28b02bc/-286Wx359H-441113672-olive-MODEL.jpg,Men,499,100,Typographic Print Shorts with Slip Pockets
Slim Fit Shirt with Patch Pocket,https://assets.ajio.com/medias/sys_master/root/20210415/3g45/60785a54f997dd7b64b30906/-286Wx359H-441120067-beige-MODEL.jpg,Men,"1,049",100,Slim Fit Shirt with Patch Pocket
