name,image_url,category,price,stock,description
Front-Open Shrug with Shawl Collar,https://assets.ajio.com/medias/sys_master/root/h5c/h4d/13634456125470/-286Wx359H-440875360-offwhite-MODEL.jpg,Women,999,100,Front-Open Shrug with Shawl Collar
V-neck Mini Shift Dress,https://assets.ajio.com/medias/sys_master/root/20210210/CzrE/6023d6dbaeb269698162639f/-286Wx359H-441088314-green-MODEL.jpg,Women,"2,299",100,V-neck Mini Shift Dress
Mid-Calf Length Pants with Insert Pockets,https://assets.ajio.com/medias/sys_master/root/20200829/O0kJ/5f4953baf997dd6918b001e7/-286Wx359H-441026485-natural-MODEL.jpg,Women,899,100,Mid-Calf Length Pants with Insert Pockets
Straight Kurta with Roll-Up Sleeve Tabs,https://assets.ajio.com/medias/sys_master/root/hb7/he5/15766002139166/-286Wx359H-441026285-yellow-MODEL.jpg,Women,899,100,Straight Kurta with Roll-Up Sleeve Tabs
Gigi Houndstooth Print Fit & Flare Dress,https://assets.ajio.com/medias/sys_master/root/20220423/Y28i/6262fdacf997dd03e27b5b62/-286Wx359H-441297184-black-MODEL.jpg,Women,"1,799",100,Gigi Houndstooth Print Fit & Flare Dress
Printed Mandarin Collared Top,https://assets.ajio.com/medias/sys_master/root/20220507/UUvf/62756bf5f997dd03e2998c1c/-286Wx359H-441139559-offwhite-MODEL.jpg,Women,599,100,Printed Mandarin Collared Top
Octavia V-neck Top,https://assets.ajio.com/medias/sys_master/root/20220528/Plcb/62913389aeb26921afed1d98/-286Wx359H-441297415-darknavy-MODEL.jpg,Women,"1,299",100,Octavia V-neck Top
Floral Print Round-Neck Top,https://assets.ajio.com/medias/sys_master/root/20210622/Q36o/60d1ad88f997ddb312e7434d/-286Wx359H-462006936-blue-MODEL.jpg,Women,"1,799",100,Floral Print Round-Neck Top
Scallop Print Round-Neck A-line Kurta Set,https://assets.ajio.com/medias/sys_master/root/20210626/YPOc/60d65b76f997ddb312f2f0c9/-286Wx359H-462557151-navy-MODEL.jpg,Women,"3,599",100,Scallop Print Round-Neck A-line Kurta Set
Floral Embroidered Unstitched Dress Material,https://assets.ajio.com/medias/sys_master/root/20210616/T9PH/60c9316cf997ddb312cc4cb5/-286Wx359H-462517523-white-MODEL.jpg,Women,"2,428",100,Floral Embroidered Unstitched Dress Material
Floral Pattern A-line Kurta,https://assets.ajio.com/medias/sys_master/root/20220601/UDRt/6296fd5ef997dd03e2566295/-286Wx359H-441095209-rust-MODEL.jpg,Women,"2,999",100,Floral Pattern A-line Kurta
Geometric Printed Traditional Saree,https://assets.ajio.com/medias/sys_master/root/20211229/rml0/61cb6968aeb269011020eeae/-286Wx359H-463259434-burgundy-MODEL.jpg,Women,"1,599",100,Geometric Printed Traditional Saree
Digital Printed Traditional Saree,https://assets.ajio.com/medias/sys_master/root/20211229/YXG8/61cb62b1aeb269011020a215/-286Wx359H-463259434-blue-MODEL.jpg,Women,"1,599",100,Digital Printed Traditional Saree
Polka-Dot Print Silk Saree ,https://assets.ajio.com/medias/sys_master/root/20220502/dQpS/626fc984f997dd03e28d7894/-286Wx359H-464266267-green-MODEL.jpg,Women,"2,189",100,Polka-Dot Print Silk Saree 
Polka-Dot Print Silk Saree ,https://assets.ajio.com/medias/sys_master/root/20220502/PjXR/626fc6b9f997dd03e28d3ba2/-286Wx359H-464266267-red-MODEL.jpg,Women,"2,189",100,Polka-Dot Print Silk Saree 
Geometric Print Georgette Saree,https://assets.ajio.com/medias/sys_master/root/20220523/vOPp/628b5004f997dd03e21288c4/-286Wx359H-463945065-red-MODEL.jpg,Women,"3,311",100,Geometric Print Georgette Saree
Polka-dot Printed Saree with Blouse Piece,https://assets.ajio.com/medias/sys_master/root/20220503/nEdv/627033adaeb26921af4f6fb4/-286Wx359H-464266267-grey-MODEL.jpg,Women,"2,189",100,Polka-dot Printed Saree with Blouse Piece
Saree with Woven Motifs,https://assets.ajio.com/medias/sys_master/root/20210627/INy3/60d8f08daeb269a9e319ef2f/-286Wx359H-461057967-grey-MODEL.jpg,Women,"4,299",100,Saree with Woven Motifs
Solid  Skinny Ripped Jeans,https://assets.ajio.com/medias/sys_master/root/20211029/CorW/617c38e7aeb2690110b1cc48/-286Wx359H-463249270-blue-MODEL.jpg,Women,"1,499",100,Solid  Skinny Ripped Jeans
Floral Woven Traditional Saree,https://assets.ajio.com/medias/sys_master/root/20220523/yztF/628b5aa0f997dd03e213655c/-286Wx359H-464275694-green-MODEL.jpg,Women,"2,599",100,Floral Woven Traditional Saree
Floral Woven Traditional Saree,https://assets.ajio.com/medias/sys_master/root/20220523/Gbb0/628b5a8cf997dd03e21363bd/-286Wx359H-464275608-peach-MODEL.jpg,Women,"2,599",100,Floral Woven Traditional Saree
Embellished Silk Saree with Lace Border,https://assets.ajio.com/medias/sys_master/root/20220526/Ts87/628e9c3af997dd03e2298f9e/-286Wx359H-464385900-green-MODEL.jpg,Women,"3,549",100,Embellished Silk Saree with Lace Border
Silk Blend Woven Design Saree ,https://assets.ajio.com/medias/sys_master/root/20220502/0NBl/626fcb82f997dd03e28da21a/-286Wx359H-464265642-green-MODEL.jpg,Women,"2,599",100,Silk Blend Woven Design Saree 
Woven Silk Traditional Saree,https://assets.ajio.com/medias/sys_master/root/20220523/DxK0/628b5ad7aeb26921afc5f01b/-286Wx359H-464275443-pink-MODEL.jpg,Women,"2,599",100,Woven Silk Traditional Saree
Cotton Blend Woven Design Saree ,https://assets.ajio.com/medias/sys_master/root/20220502/hDpl/626fc708aeb26921af4e3bdf/-286Wx359H-464265664-pink-MODEL.jpg,Women,"2,599",100,Cotton Blend Woven Design Saree 
Floral Woven Traditional Saree,https://assets.ajio.com/medias/sys_master/root/20220523/fFne/628b5369aeb26921afc55b47/-286Wx359H-464275625-green-MODEL.jpg,Women,"2,599",100,Floral Woven Traditional Saree
Floral Print Silk Saree,https://assets.ajio.com/medias/sys_master/root/20220513/FqjY/627d7979aeb26921af72f47c/-286Wx359H-464325348-grey-MODEL.jpg,Women,"2,849",100,Floral Print Silk Saree
Silk Blend Woven Design Saree,https://assets.ajio.com/medias/sys_master/root/20220502/p1vs/626fc482f997dd03e28d0749/-286Wx359H-464265617-grey-MODEL.jpg,Women,"2,599",100,Silk Blend Woven Design Saree
Woven Silk Traditional Saree,https://assets.ajio.com/medias/sys_master/root/20220523/k7Es/628b5eb7f997dd03e213ae11/-286Wx359H-464275513-beige-MODEL.jpg,Women,"2,599",100,Woven Silk Traditional Saree
Floral Woven Traditional Saree,https://assets.ajio.com/medias/sys_master/root/20220523/RDdM/628b5ab1aeb26921afc5ed0a/-286Wx359H-464275643-beige-MODEL.jpg,Women,"2,599",100,Floral Woven Traditional Saree
Saree with Floral Woven Motifs,https://assets.ajio.com/medias/sys_master/root/20220601/QWVg/6296861df997dd03e2534a40/-286Wx359H-464416283-maroon-MODEL.jpg,Women,"2,129",100,Saree with Floral Woven Motifs
Saree with Floral Woven Motifs,https://assets.ajio.com/medias/sys_master/root/20220601/WPKD/62968132f997dd03e252ad16/-286Wx359H-464416184-pink-MODEL.jpg,Women,"2,129",100,Saree with Floral Woven Motifs
Saree with Floral Woven Motifs,https://assets.ajio.com/medias/sys_master/root/20220601/FKeZ/629685bff997dd03e2533efd/-286Wx359H-464416238-navy-MODEL.jpg,Women,"2,129",100,Saree with Floral Woven Motifs
Saree with Floral Woven Motifs,https://assets.ajio.com/medias/sys_master/root/20220601/Prum/62968292f997dd03e252db70/-286Wx359H-464416190-grey-MODEL.jpg,Women,"2,629",100,Saree with Floral Woven Motifs
Striped Saree with Zari Border,https://assets.ajio.com/medias/sys_master/root/20220601/OF0f/6296852baeb26921afff9a6e/-286Wx359H-464416240-blue-MODEL.jpg,Women,"2,849",100,Striped Saree with Zari Border
Saree with Geometric Woven Motifs,https://assets.ajio.com/medias/sys_master/root/20220601/tC4v/629685e9f997dd03e253438b/-286Wx359H-464416176-cream-MODEL.jpg,Women,"3,199",100,Saree with Geometric Woven Motifs
Floral Embroidered Traditional Saree,https://assets.ajio.com/medias/sys_master/root/20220601/ExQd/6296851eaeb26921afff98ed/-286Wx359H-464416455-yellow-MODEL.jpg,Women,"3,549",100,Floral Embroidered Traditional Saree
Floral Print Saree with Blouse Piece,https://assets.ajio.com/medias/sys_master/root/20220601/GWpK/62968540f997dd03e253307c/-286Wx359H-464416628-beige-MODEL.jpg,Women,"2,779",100,Floral Print Saree with Blouse Piece
Saree with Floral Woven Motifs,https://assets.ajio.com/medias/sys_master/root/20220601/eT6F/62968178f997dd03e252b6b7/-286Wx359H-464416148-yellow-MODEL.jpg,Women,"3,199",100,Saree with Floral Woven Motifs
Saree with Floral Woven Motifs,https://assets.ajio.com/medias/sys_master/root/20220601/Kgmm/6296838daeb26921afff69fa/-286Wx359H-464416189-purple-MODEL.jpg,Women,"2,629",100,Saree with Floral Woven Motifs
Saree with Floral Woven Motifs,https://assets.ajio.com/medias/sys_master/root/20220601/kyl3/62968769f997dd03e2536e53/-286Wx359H-464416263-green-MODEL.jpg,Women,"2,129",100,Saree with Floral Woven Motifs
Saree with Floral Woven Motifs,https://assets.ajio.com/medias/sys_master/root/20220601/pefh/629684afaeb26921afff8bff/-286Wx359H-464416317-green-MODEL.jpg,Women,"2,629",100,Saree with Floral Woven Motifs
Embellished A-line Dress,https://assets.ajio.com/medias/sys_master/root/20220530/AMhL/6294d592f997dd03e246d9cb/-286Wx359H-464401122-yellow-MODEL.jpg,Women,"2,379",100,Embellished A-line Dress
Embellished  A-line Dress,https://assets.ajio.com/medias/sys_master/root/20220530/FgJF/6294d58caeb26921aff43ea6/-286Wx359H-464401120-maroon-MODEL.jpg,Women,"2,379",100,Embellished  A-line Dress
Polka-Dot Print Back-Open Blouse,https://assets.ajio.com/medias/sys_master/root/20220409/sPm0/6250a177f997dd03e251a862/-286Wx359H-464149757-orange-MODEL.jpg,Women,"1,479",100,Polka-Dot Print Back-Open Blouse
Embellished Round-Neck Back-Open Blouse,https://assets.ajio.com/medias/sys_master/root/20220409/F1wa/6250a0a6f997dd03e251994d/-286Wx359H-464150580-purple-MODEL.jpg,Women,"1,679",100,Embellished Round-Neck Back-Open Blouse
Embellished Round-Neck Back-Open Blouse,https://assets.ajio.com/medias/sys_master/root/20220409/K385/6250a133f997dd03e251a2d8/-286Wx359H-464150580-gold-MODEL.jpg,Women,"1,679",100,Embellished Round-Neck Back-Open Blouse
Heart Print T-shirt & Pyjama  Set,https://assets.ajio.com/medias/sys_master/root/20220330/UoTT/62449791f997dd03e23dcefe/-286Wx359H-464096217-red-MODEL.jpg,Women,"3,499",100,Heart Print T-shirt & Pyjama  Set
Lace Hipsters with Elasticated Waistband,https://assets.ajio.com/medias/sys_master/root/20220128/02K6/61f3aa05aeb2695cdd380434/-286Wx359H-463194840-blue-MODEL.jpg,Women,499,100,Lace Hipsters with Elasticated Waistband
Mimosa Women's Kanjivaram Art Silk Saree With Unstiched Brocade Blouse  (5567-617-2D-ST-WT ) Saree,https://assets.ajio.com/medias/sys_master/root/20220429/m8fV/626bccafaeb26921af4aa714/-286Wx359H-464256708-pink-MODEL.jpg,Women,"6,299",100,Mimosa Women's Kanjivaram Art Silk Saree With Unstiched Brocade Blouse  (5567-617-2D-ST-WT ) Saree
Round-Neck Blouse with Pintucks,https://assets.ajio.com/medias/sys_master/root/ajio/catalog/5efc4466481085a2e2691465/-286Wx359H-460628341-purple-MODEL.jpg,Women,"2,499",100,Round-Neck Blouse with Pintucks
Printed Straight Kurta with Palazzos,https://assets.ajio.com/medias/sys_master/root/20220521/w5pD/62885db5f997dd03e2016939/-286Wx359H-441140961-ltaqua-MODEL.jpg,Women,"1,499",100,Printed Straight Kurta with Palazzos
Paisley Print Round-Neck Straight Kurta,https://assets.ajio.com/medias/sys_master/root/20220528/eF4w/6291bf34aeb26921aff09e53/-286Wx359H-441145454-peach-MODEL.jpg,Women,599,100,Paisley Print Round-Neck Straight Kurta
Printed Straight Kurta with Embroidered Yoke,https://assets.ajio.com/medias/sys_master/root/20220504/3cHm/62718087f997dd03e2925b28/-286Wx359H-441144420-coral-MODEL.jpg,Women,699,100,Printed Straight Kurta with Embroidered Yoke
Lightly Washed Skinny Fit Jeans,https://assets.ajio.com/medias/sys_master/root/20220531/ENZt/6295818ef997dd03e24d83da/-286Wx359H-441130068-mediumblue-MODEL.jpg,Women,"1,299",100,Lightly Washed Skinny Fit Jeans
Cotton Round-Neck Top,https://assets.ajio.com/medias/sys_master/root/20220108/5zOk/61d8ad0df997dd6623165e96/-286Wx359H-463624974-purple-MODEL.jpg,Women,299,100,Cotton Round-Neck Top
Striped Sleeveless Top,https://assets.ajio.com/medias/sys_master/root/20220523/3Eoy/628b47eaf997dd03e211be72/-286Wx359H-463943355-maroon-MODEL.jpg,Women,599,100,Striped Sleeveless Top
Printed Crew-Neck T-shirt,https://assets.ajio.com/medias/sys_master/root/20220407/se3V/624dfc1af997dd03e24ca19a/-286Wx359H-464135832-cream-MODEL.jpg,Women,799,100,Printed Crew-Neck T-shirt
Embroidered Under-Wired T-shirt Bra,https://assets.ajio.com/medias/sys_master/root/20220602/gLOI/6297cfcaaeb26921af06253f/-286Wx359H-464422382-black-MODEL.jpg,Women,"2,499",100,Embroidered Under-Wired T-shirt Bra
Lace Under-Wired T-shirt Bra,https://assets.ajio.com/medias/sys_master/root/20220602/6Z22/6297d015aeb26921af062e1c/-286Wx359H-464422351-black-MODEL.jpg,Women,"1,699",100,Lace Under-Wired T-shirt Bra
Pack of 2 Hipsters,https://assets.ajio.com/medias/sys_master/root/20220602/NmOA/6297d24bf997dd03e25ae5e3/-286Wx359H-464423698-beige-MODEL.jpg,Women,"1,299",100,Pack of 2 Hipsters
Linen Top with Embroidery,https://assets.ajio.com/medias/sys_master/root/20220602/O1WD/6297cc9baeb26921af05b8c8/-286Wx359H-464424554-black-MODEL.jpg,Women,"3,999",100,Linen Top with Embroidery
Pack of 5 Brazillian Panties,https://assets.ajio.com/medias/sys_master/root/20220602/74YO/6297d252aeb26921af0678d3/-286Wx359H-464423317-multi-MODEL.jpg,Women,"1,499",100,Pack of 5 Brazillian Panties
Lace Brazillian Panties,https://assets.ajio.com/medias/sys_master/root/20220602/f4Aj/6297d1e5f997dd03e25ad930/-286Wx359H-464423513-purple-MODEL.jpg,Women,799,100,Lace Brazillian Panties
Pack of 5 Printed Bikinis,https://assets.ajio.com/medias/sys_master/root/20220602/d1m6/6297d502f997dd03e25b2868/-286Wx359H-464423464-blue-MODEL.jpg,Women,999,100,Pack of 5 Printed Bikinis
Striped V-neck Pullover,https://assets.ajio.com/medias/sys_master/root/20220526/ldZ1/628e95ceaeb26921afd9367c/-286Wx359H-464384860-black-MODEL.jpg,Women,"1,499",100,Striped V-neck Pullover
Shirt & Pyjama Set,https://assets.ajio.com/medias/sys_master/root/20220602/xBv8/6297d31ff997dd03e25aff6b/-286Wx359H-464424625-yellow-MODEL.jpg,Women,"3,499",100,Shirt & Pyjama Set
Graphic Print Nightshirt,https://assets.ajio.com/medias/sys_master/root/20220602/LBSK/6297cca8f997dd03e25a2579/-286Wx359H-464424693-cream-MODEL.jpg,Women,"2,499",100,Graphic Print Nightshirt
Solid Tapered Fit Cargo Pants,https://assets.ajio.com/medias/sys_master/root/20220409/2Qcm/6250a55faeb26921af152b32/-286Wx359H-464099505-khaki-MODEL.jpg,Women,"2,999",100,Solid Tapered Fit Cargo Pants
Embroidered Under-Wired T-shirt Bra,https://assets.ajio.com/medias/sys_master/root/20220602/f7jd/6297cf0df997dd03e25a789b/-286Wx359H-464422288-orange-MODEL.jpg,Women,"2,499",100,Embroidered Under-Wired T-shirt Bra
Pack of 2 Hipsters,https://assets.ajio.com/medias/sys_master/root/20220602/82UJ/6297d27ff997dd03e25aeb83/-286Wx359H-464423575-beige-MODEL.jpg,Women,"1,299",100,Pack of 2 Hipsters
Zip-Front Hoodie with Split Kangaroo Pockets,https://assets.ajio.com/medias/sys_master/root/20220527/gghn/628fed5cf997dd03e23550f5/-286Wx359H-464393609-burgundy-MODEL.jpg,Women,"2,999",100,Zip-Front Hoodie with Split Kangaroo Pockets
Graphic Print T-Shirt & Shorts Set,https://assets.ajio.com/medias/sys_master/root/20220602/s0ub/6297d521f997dd03e25b2c54/-286Wx359H-464424567-pink-MODEL.jpg,Women,"1,499",100,Graphic Print T-Shirt & Shorts Set
Floral print Loungewear Set with Eye Mask,https://assets.ajio.com/medias/sys_master/root/20220602/TyaX/6297d2a2aeb26921af0681a3/-286Wx359H-464423897-cream-MODEL.jpg,Women,"3,499",100,Floral print Loungewear Set with Eye Mask
Floral Print Loungewear Set,https://assets.ajio.com/medias/sys_master/root/20220602/u2Qb/6297d293f997dd03e25aee09/-286Wx359H-464423878-pink-MODEL.jpg,Women,"2,999",100,Floral Print Loungewear Set
Animal Print Nightgown,https://assets.ajio.com/medias/sys_master/root/20220602/MzHu/6297cc93f997dd03e25a22e1/-286Wx359H-464424677-pink-MODEL.jpg,Women,"1,499",100,Animal Print Nightgown
Pack of 5 Printed Bikinis,https://assets.ajio.com/medias/sys_master/root/20220602/JPmM/6297d295aeb26921af067ff1/-286Wx359H-464423386-blue-MODEL.jpg,Women,999,100,Pack of 5 Printed Bikinis
Graphic Print Top & Pyjama Set,https://assets.ajio.com/medias/sys_master/root/20220602/1jmY/6297d34ff997dd03e25b04e8/-286Wx359H-464424594-yellow-MODEL.jpg,Women,"2,499",100,Graphic Print Top & Pyjama Set
Printed Top & Pyjama Set,https://assets.ajio.com/medias/sys_master/root/20220602/IfXX/6297d34baeb26921af069622/-286Wx359H-464424579-blue-MODEL.jpg,Women,"2,999",100,Printed Top & Pyjama Set
Shirt with Patch Pocket,https://assets.ajio.com/medias/sys_master/root/20220601/aIaG/629685c5f997dd03e2533fcc/-286Wx359H-464418556-blue-MODEL.jpg,Women,"2,999",100,Shirt with Patch Pocket
Floral Print Chemise,https://assets.ajio.com/medias/sys_master/root/20220601/GDyS/6296852cf997dd03e2532e2b/-286Wx359H-464418322-pink-MODEL.jpg,Women,"1,699",100,Floral Print Chemise
Printed Top & Shorts Set,https://assets.ajio.com/medias/sys_master/root/20220602/61Rb/6297d2f2f997dd03e25af9f7/-286Wx359H-464424582-blue-MODEL.jpg,Women,"1,999",100,Printed Top & Shorts Set
Graphic Print Loungewear Set,https://assets.ajio.com/medias/sys_master/root/20220602/b7Dn/6297ccb5f997dd03e25a2769/-286Wx359H-464424614-pink-MODEL.jpg,Women,"1,999",100,Graphic Print Loungewear Set
Non-Wired T-shirt Bra,https://assets.ajio.com/medias/sys_master/root/20220602/M8q7/6297cfb0aeb26921af0621a1/-286Wx359H-464422099-purple-MODEL.jpg,Women,"2,499",100,Non-Wired T-shirt Bra
Polka-Dot Print Nightgown,https://assets.ajio.com/medias/sys_master/root/20220602/4Pk9/6297cc6ef997dd03e25a1f33/-286Wx359H-464424779-navy-MODEL.jpg,Women,"1,699",100,Polka-Dot Print Nightgown
Printed T-Shirt & Shorts Set,https://assets.ajio.com/medias/sys_master/root/20220602/wzWB/6297d332f997dd03e25b01bc/-286Wx359H-464424558-green-MODEL.jpg,Women,"1,499",100,Printed T-Shirt & Shorts Set
Solid Tapered Fit Trousers,https://assets.ajio.com/medias/sys_master/root/20220523/qpeJ/628b8d01aeb26921afc80535/-286Wx359H-464371528-blue-MODEL.jpg,Women,"2,999",100,Solid Tapered Fit Trousers
Floral Print Tapered Fit Pleat-Front Pants,https://assets.ajio.com/medias/sys_master/root/20220526/lRHp/628e96acaeb26921afd94cd3/-286Wx359H-464385128-black-MODEL.jpg,Women,"2,999",100,Floral Print Tapered Fit Pleat-Front Pants
Brazillian Panties with Lace Panel,https://assets.ajio.com/medias/sys_master/root/20220602/vDL1/6297d1adf997dd03e25ad1da/-286Wx359H-464423639-black-MODEL.jpg,Women,799,100,Brazillian Panties with Lace Panel
Solid Blouson Top with Drawstring Tie,https://assets.ajio.com/medias/sys_master/root/20220523/x4Yl/628b8d48f997dd03e2156ebb/-286Wx359H-464366292-purple-MODEL.jpg,Women,"1,999",100,Solid Blouson Top with Drawstring Tie
Striped Loungewear Set,https://assets.ajio.com/medias/sys_master/root/20220602/6Nfe/6297ccdbf997dd03e25a2cca/-286Wx359H-464424638-black-MODEL.jpg,Women,"3,499",100,Striped Loungewear Set
Solid Tapered Fit Trousers,https://assets.ajio.com/medias/sys_master/root/20220331/MQxT/624592a6aeb26921af03702d/-286Wx359H-464099684-red-MODEL.jpg,Women,"2,999",100,Solid Tapered Fit Trousers
Pack of 2 Graphic Print Nightgowns,https://assets.ajio.com/medias/sys_master/root/20220602/1Qo1/6297ccdcaeb26921af05c209/-286Wx359H-464424762-nude-MODEL.jpg,Women,"2,999",100,Pack of 2 Graphic Print Nightgowns
Graphic Print T-shirt & Pyjama  Set,https://assets.ajio.com/medias/sys_master/root/20220330/TJ8r/624497c7aeb26921af01d803/-286Wx359H-464096233-pink-MODEL.jpg,Women,"2,999",100,Graphic Print T-shirt & Pyjama  Set
Pack of 2 Graphic Print Nightgowns,https://assets.ajio.com/medias/sys_master/root/20220602/uNKf/6297cc8daeb26921af05b6f2/-286Wx359H-464424772-grey-MODEL.jpg,Women,"2,999",100,Pack of 2 Graphic Print Nightgowns
Solid Leggings with Elasticated Waistband,https://assets.ajio.com/medias/sys_master/root/20220602/2L1h/6297d061aeb26921af06388e/-286Wx359H-464422016-grey-MODEL.jpg,Women,"2,999",100,Solid Leggings with Elasticated Waistband
Floral Print Nightgown,https://assets.ajio.com/medias/sys_master/root/20220602/0Aso/6297cc93aeb26921af05b7ec/-286Wx359H-464424804-cream-MODEL.jpg,Women,"1,999",100,Floral Print Nightgown
Polka-Dot Print Baby-Doll & Panty Set,https://assets.ajio.com/medias/sys_master/root/20220528/LO25/629138d7aeb26921afed8f1e/-286Wx359H-464396442-blue-MODEL.jpg,Women,"2,499",100,Polka-Dot Print Baby-Doll & Panty Set
Brazillian Panties with Lace Panel,https://assets.ajio.com/medias/sys_master/root/20220602/kC8r/6297d4ddaeb26921af06b4f2/-286Wx359H-464423639-purple-MODEL.jpg,Women,799,100,Brazillian Panties with Lace Panel
Pack of 2 Hipsters,https://assets.ajio.com/medias/sys_master/root/20220602/j43J/6297d1dff997dd03e25ad86e/-286Wx359H-464423698-black-MODEL.jpg,Women,"1,299",100,Pack of 2 Hipsters
Under-Wired Minimiser Bra,https://assets.ajio.com/medias/sys_master/root/20220602/lb7x/6297cf62f997dd03e25a8425/-286Wx359H-464422117-black-MODEL.jpg,Women,"2,499",100,Under-Wired Minimiser Bra
Crew-Neck T-shirt,https://assets.ajio.com/medias/sys_master/root/20220601/CJuE/6297a230f997dd03e259a92a/-286Wx359H-464390415-khaki-MODEL.jpg,Women,799,100,Crew-Neck T-shirt
Printed T-Shirt & Pyjama Set,https://assets.ajio.com/medias/sys_master/root/20220602/HAEV/6297d52df997dd03e25b2dc7/-286Wx359H-464423826-pink-MODEL.jpg,Women,"1,499",100,Printed T-Shirt & Pyjama Set
Short-Sleeve Crew-Neck T-shirt,https://assets.ajio.com/medias/sys_master/root/20220524/TtJl/628bfa25f997dd03e218cc10/-286Wx359H-464375124-pink-MODEL.jpg,Women,799,100,Short-Sleeve Crew-Neck T-shirt
Mid-Rise Flared Jeans,https://assets.ajio.com/medias/sys_master/root/20220523/WhE8/628b7663f997dd03e2148fd1/-286Wx359H-464365978-indigo-MODEL.jpg,Women,"3,499",100,Mid-Rise Flared Jeans
Solid Wide Leg Trousers,https://assets.ajio.com/medias/sys_master/root/20220523/Y3jm/628b8fc1aeb26921afc83413/-286Wx359H-464371524-grey-MODEL.jpg,Women,"2,499",100,Solid Wide Leg Trousers
Ribbed V-neck Pullover,https://assets.ajio.com/medias/sys_master/root/20220524/TuAx/628c0602aeb26921afcb5b33/-286Wx359H-464376294-navy-MODEL.jpg,Women,"3,499",100,Ribbed V-neck Pullover
Pack of 5 Hipster Briefs,https://assets.ajio.com/medias/sys_master/root/20220602/Ua9N/6297cec0f997dd03e25a6ec7/-286Wx359H-464422225-multi-MODEL.jpg,Women,"1,499",100,Pack of 5 Hipster Briefs
Heathered T-shirt & Pyjamas Set,https://assets.ajio.com/medias/sys_master/root/20220528/PtdN/62913d95f997dd03e23fde0f/-286Wx359H-464398158-grey-MODEL.jpg,Women,"1,499",100,Heathered T-shirt & Pyjamas Set
V-neck Floral Print Top,https://assets.ajio.com/medias/sys_master/root/20220523/b4Y7/628b7a8af997dd03e214b9e7/-286Wx359H-464366119-multi-MODEL.jpg,Women,799,100,V-neck Floral Print Top
Ribbed High Neck Pullover,https://assets.ajio.com/medias/sys_master/root/20220211/5MgP/62057ed7f997dd03e2cad502/-286Wx359H-463807810-navy-MODEL.jpg,Women,"1,999",100,Ribbed High Neck Pullover
Solid Slim Fit Trousers,https://assets.ajio.com/medias/sys_master/root/20220426/3QoP/626808e9aeb26921af449ec2/-286Wx359H-464239255-beige-MODEL.jpg,Women,"1,749",100,Solid Slim Fit Trousers
 Indian Straight Fit Kurta,https://assets.ajio.com/medias/sys_master/root/20211029/CEAD/617c3587f997ddf8f1f1fb16/-286Wx359H-463247636-yellow-MODEL.jpg,Women,"1,299",100, Indian Straight Fit Kurta
Pack of 2 Leggings with Elasticated Waist,https://assets.ajio.com/medias/sys_master/root/20220524/Bio5/628bfcadf997dd03e218eed5/-286Wx359H-464375299-blue-MODEL.jpg,Women,"2,399",100,Pack of 2 Leggings with Elasticated Waist
Leggings with Elasticated Waist,https://assets.ajio.com/medias/sys_master/root/20220524/MGZI/628c0193f997dd03e219184a/-286Wx359H-464375224-pink-MODEL.jpg,Women,"1,550",100,Leggings with Elasticated Waist
Typographic Print Crew-Neck Sweatshirt with Applique,https://assets.ajio.com/medias/sys_master/root/h15/h7b/15066049151006/-286Wx359H-441035485-blue-MODEL.jpg,Women,"1,045",100,Typographic Print Crew-Neck Sweatshirt with Applique
Floral Print Flared Kurta,https://assets.ajio.com/medias/sys_master/root/20220601/KcRO/62971c1ef997dd03e256fa24/-286Wx359H-441095082-white-MODEL.jpg,Women,"2,999",100,Floral Print Flared Kurta
Pack of 2 Fitness Sports Bra,https://assets.ajio.com/medias/sys_master/root/20220520/Wukp/6286a9d9f997dd03e2f633a2/-286Wx359H-464356399-red-MODEL.jpg,Women,"2,398",100,Pack of 2 Fitness Sports Bra
Knitted Shrug with Button Closure,https://assets.ajio.com/medias/sys_master/root/h69/h70/13607183777822/-286Wx359H-440875359-blue-MODEL.jpg,Women,999,100,Knitted Shrug with Button Closure
Round-Neck Peplum Top with Ruched Detail,https://assets.ajio.com/medias/sys_master/root/20220519/6DuP/62861ffeaeb26921afa824a9/-286Wx359H-440920154-rust-MODEL.jpg,Women,"1,499",100,Round-Neck Peplum Top with Ruched Detail
Strappy Top with Elasticated Back,https://assets.ajio.com/medias/sys_master/root/ha6/had/15817027944478/-286Wx359H-441043615-brown-MODEL.jpg,Women,"1,499",100,Strappy Top with Elasticated Back
Panelled Cotton Leggings,https://assets.ajio.com/medias/sys_master/root/20200910/pbDZ/5f5925f0aeb269ef8ebca29c/-286Wx359H-460712254-blue-MODEL.jpg,Women,"1,799",100,Panelled Cotton Leggings
Floral Print One-Shoulder Top,https://assets.ajio.com/medias/sys_master/root/20220524/Uckd/628d1992f997dd03e21e9581/-286Wx359H-441090443-multi-MODEL.jpg,Women,"1,299",100,Floral Print One-Shoulder Top
Checked A-line Dress with Tie-Up,https://assets.ajio.com/medias/sys_master/root/20200916/15f1/5f622a47f997dd8c833fdd0c/-286Wx359H-440983990-black-MODEL.jpg,Women,"2,999",100,Checked A-line Dress with Tie-Up
Textured Racer-Back Tank Top,https://assets.ajio.com/medias/sys_master/root/20200915/Si2f/5f60da08aeb269d563bfdfdc/-286Wx359H-460712288-aqua-MODEL.jpg,Women,999,100,Textured Racer-Back Tank Top
Striped Long Shrug,https://assets.ajio.com/medias/sys_master/root/h4f/h98/15816237907998/-286Wx359H-441043667-ombre-MODEL.jpg,Women,"2,499",100,Striped Long Shrug
Button-Down Straight Kurta,https://assets.ajio.com/medias/sys_master/root/20220521/IXlz/6287fee8aeb26921afb447ec/-286Wx359H-464363222-grey-MODEL.jpg,Women,798,100,Button-Down Straight Kurta
